{
  "certificate_id": "certificate-dd404e0d479e6fc806ce9905",
  "theme_id": "semiconductors",
  "as_of_utc": "2026-08-10T19:45:00Z",
  "evidence_grade": "synthetic_demo",
  "facts": [
    {
      "kind": "synthetic",
      "text": "positive_exhausted"
    }
  ],
  "direction": {
    "state": "positive",
    "eligible": true,
    "data_ready": true,
    "model_estimated": true,
    "decision_eligible": true,
    "uncertainty": 0.2,
    "evidence_refs": [
      "synthetic:positive_exhausted:direction"
    ],
    "metrics": {},
    "invalidation": "Synthetic invalidation condition."
  },
  "transmission": {
    "state": "broad_confirmed",
    "eligible": true,
    "data_ready": true,
    "model_estimated": true,
    "decision_eligible": true,
    "uncertainty": 0.2,
    "evidence_refs": [
      "synthetic:positive_exhausted:transmission"
    ],
    "metrics": {},
    "invalidation": "Synthetic invalidation condition."
  },
  "episode": {
    "state": "exhaustion",
    "eligible": true,
    "data_ready": true,
    "model_estimated": true,
    "decision_eligible": true,
    "uncertainty": 0.2,
    "evidence_refs": [
      "synthetic:positive_exhausted:episode"
    ],
    "metrics": {},
    "invalidation": "Synthetic invalidation condition."
  },
  "structural_attention": {
    "state": "high",
    "eligible": true,
    "data_ready": true,
    "model_estimated": true,
    "decision_eligible": false,
    "uncertainty": 0.2,
    "evidence_refs": [
      "synthetic:positive_exhausted:theme_radar_attention"
    ],
    "metrics": {},
    "invalidation": "Synthetic invalidation condition."
  },
  "fragility": {
    "state": "high",
    "eligible": true,
    "data_ready": true,
    "model_estimated": true,
    "decision_eligible": true,
    "uncertainty": 0.2,
    "evidence_refs": [
      "synthetic:positive_exhausted:fragility"
    ],
    "metrics": {},
    "invalidation": "Synthetic invalidation condition."
  },
  "observer_agreement": {
    "score": 0.8,
    "estimated_observers": 5,
    "conflict_count": 1,
    "state": "conflicted"
  },
  "observer_conflicts": [
    {
      "theme_id": "semiconductors",
      "left": "direction",
      "right": "episode",
      "kind": "timing_conflict",
      "explanation": "Direction remains positive but the response mode appears exhausted.",
      "severity": "medium",
      "discriminating_probe": "Wait for a retest or failed-extension observation."
    }
  ],
  "uncertainty": 0.2,
  "invalidation": [
    "Synthetic invalidation condition.",
    "Synthetic invalidation condition.",
    "Synthetic invalidation condition.",
    "Synthetic invalidation condition.",
    "Synthetic invalidation condition."
  ],
  "next_probe": {
    "probe_id": "semiconductors-retest",
    "theme_id": "semiconductors",
    "acquire": "Next pullback with Direction persistence and Transmission coherence.",
    "distinguishes": [
      "orderly retest",
      "failed extension"
    ],
    "deadline_utc": "2026-08-10T19:45:00Z",
    "expected_information_value": "medium",
    "acquisition_cost": "one to three scheduled observations",
    "latency": "before the next playbook transition",
    "reason": "Fresh entry timing is uncertain late in the episode.",
    "status": "proposed",
    "question": "Will an orderly retest preserve the positive structure?"
  },
  "eligible_playbooks": [
    "F_overextended_no_chase"
  ],
  "vehicle_eligibility": {
    "Theme_ETF": false,
    "Theme_Basket": false,
    "Torque_Overlay": false
  },
  "decision_status": "WAIT"
}
