{
  "certificate_id": "certificate-e68be6438a554e29964efb4f",
  "theme_id": "semiconductors",
  "as_of_utc": "2026-08-10T19:45:00Z",
  "evidence_grade": "synthetic_demo",
  "facts": [
    {
      "kind": "synthetic",
      "text": "positive_narrow"
    }
  ],
  "direction": {
    "state": "positive",
    "eligible": true,
    "data_ready": true,
    "model_estimated": true,
    "decision_eligible": true,
    "uncertainty": 0.2,
    "evidence_refs": [
      "synthetic:positive_narrow:direction"
    ],
    "metrics": {},
    "invalidation": "Synthetic invalidation condition."
  },
  "transmission": {
    "state": "narrow_only",
    "eligible": true,
    "data_ready": true,
    "model_estimated": true,
    "decision_eligible": true,
    "uncertainty": 0.2,
    "evidence_refs": [
      "synthetic:positive_narrow:transmission"
    ],
    "metrics": {},
    "invalidation": "Synthetic invalidation condition."
  },
  "episode": {
    "state": "expansion",
    "eligible": true,
    "data_ready": true,
    "model_estimated": true,
    "decision_eligible": true,
    "uncertainty": 0.2,
    "evidence_refs": [
      "synthetic:positive_narrow:episode"
    ],
    "metrics": {},
    "invalidation": "Synthetic invalidation condition."
  },
  "structural_attention": {
    "state": "high",
    "eligible": true,
    "data_ready": true,
    "model_estimated": true,
    "decision_eligible": false,
    "uncertainty": 0.2,
    "evidence_refs": [
      "synthetic:positive_narrow:theme_radar_attention"
    ],
    "metrics": {},
    "invalidation": "Synthetic invalidation condition."
  },
  "fragility": {
    "state": "high",
    "eligible": true,
    "data_ready": true,
    "model_estimated": true,
    "decision_eligible": true,
    "uncertainty": 0.2,
    "evidence_refs": [
      "synthetic:positive_narrow:fragility"
    ],
    "metrics": {},
    "invalidation": "Synthetic invalidation condition."
  },
  "observer_agreement": {
    "score": 0.8,
    "estimated_observers": 5,
    "conflict_count": 1,
    "state": "conflicted"
  },
  "observer_conflicts": [
    {
      "theme_id": "semiconductors",
      "left": "direction",
      "right": "transmission",
      "kind": "support_conflict",
      "explanation": "Positive tracker direction is concentrated rather than broadly transmitted.",
      "severity": "high",
      "discriminating_probe": "Measure rest-of-basket breadth and single-name concentration."
    }
  ],
  "uncertainty": 0.2,
  "invalidation": [
    "Synthetic invalidation condition.",
    "Synthetic invalidation condition.",
    "Synthetic invalidation condition.",
    "Synthetic invalidation condition.",
    "Synthetic invalidation condition."
  ],
  "next_probe": {
    "probe_id": "semiconductors-propagation",
    "theme_id": "semiconductors",
    "acquire": "Rest-of-basket breadth, median residual, volume breadth, and concentration.",
    "distinguishes": [
      "broad propagation",
      "single-name impulse"
    ],
    "deadline_utc": "2026-08-10T19:45:00Z",
    "expected_information_value": "high",
    "acquisition_cost": "one constituent snapshot",
    "latency": "next frozen observation",
    "reason": "Direction is positive but support is narrow.",
    "status": "proposed",
    "question": "Is leadership propagating to the rest of the theme?"
  },
  "eligible_playbooks": [
    "NoScript"
  ],
  "vehicle_eligibility": {
    "Theme_ETF": false,
    "Theme_Basket": false,
    "Torque_Overlay": false
  },
  "decision_status": "WAIT"
}
