{
  "certificate_id": "certificate-883710d08e2907a5a5c80d2d",
  "theme_id": "semiconductors",
  "as_of_utc": "2026-08-10T19:45:00Z",
  "evidence_grade": "synthetic_demo",
  "facts": [
    {
      "kind": "synthetic",
      "text": "retest_continuation"
    }
  ],
  "direction": {
    "state": "positive",
    "eligible": true,
    "data_ready": true,
    "model_estimated": true,
    "decision_eligible": true,
    "uncertainty": 0.2,
    "evidence_refs": [
      "synthetic:retest_continuation:direction"
    ],
    "metrics": {},
    "invalidation": "Synthetic invalidation condition."
  },
  "transmission": {
    "state": "broad_confirmed",
    "eligible": true,
    "data_ready": true,
    "model_estimated": true,
    "decision_eligible": true,
    "uncertainty": 0.2,
    "evidence_refs": [
      "synthetic:retest_continuation:transmission"
    ],
    "metrics": {},
    "invalidation": "Synthetic invalidation condition."
  },
  "episode": {
    "state": "retest",
    "eligible": true,
    "data_ready": true,
    "model_estimated": true,
    "decision_eligible": true,
    "uncertainty": 0.2,
    "evidence_refs": [
      "synthetic:retest_continuation:episode"
    ],
    "metrics": {},
    "invalidation": "Synthetic invalidation condition."
  },
  "structural_attention": {
    "state": "persistent",
    "eligible": true,
    "data_ready": true,
    "model_estimated": true,
    "decision_eligible": false,
    "uncertainty": 0.2,
    "evidence_refs": [
      "synthetic:retest_continuation:theme_radar_attention"
    ],
    "metrics": {},
    "invalidation": "Synthetic invalidation condition."
  },
  "fragility": {
    "state": "medium",
    "eligible": true,
    "data_ready": true,
    "model_estimated": true,
    "decision_eligible": true,
    "uncertainty": 0.2,
    "evidence_refs": [
      "synthetic:retest_continuation:fragility"
    ],
    "metrics": {},
    "invalidation": "Synthetic invalidation condition."
  },
  "observer_agreement": {
    "score": 1.0,
    "estimated_observers": 5,
    "conflict_count": 0,
    "state": "no_detected_conflict"
  },
  "observer_conflicts": [],
  "uncertainty": 0.2,
  "invalidation": [
    "Synthetic invalidation condition.",
    "Synthetic invalidation condition.",
    "Synthetic invalidation condition.",
    "Synthetic invalidation condition.",
    "Synthetic invalidation condition."
  ],
  "next_probe": null,
  "eligible_playbooks": [
    "B_retest_continuation"
  ],
  "vehicle_eligibility": {
    "Theme_ETF": true,
    "Theme_Basket": true,
    "Torque_Overlay": false
  },
  "decision_status": "MODEL_SHADOW_ONLY"
}
