{
  "certificate_id": "certificate-669cfbb92aaf5e9cb4bb39cd",
  "theme_id": "semiconductors",
  "as_of_utc": "2026-08-10T19:45:00Z",
  "evidence_grade": "synthetic_demo",
  "facts": [
    {
      "kind": "synthetic",
      "text": "attention_rising_direction_unresolved"
    }
  ],
  "direction": {
    "state": "unresolved",
    "eligible": true,
    "data_ready": true,
    "model_estimated": true,
    "decision_eligible": true,
    "uncertainty": 0.2,
    "evidence_refs": [
      "synthetic:attention_rising_direction_unresolved:direction"
    ],
    "metrics": {},
    "invalidation": "Synthetic invalidation condition."
  },
  "transmission": {
    "state": "absent",
    "eligible": true,
    "data_ready": true,
    "model_estimated": true,
    "decision_eligible": true,
    "uncertainty": 0.2,
    "evidence_refs": [
      "synthetic:attention_rising_direction_unresolved:transmission"
    ],
    "metrics": {},
    "invalidation": "Synthetic invalidation condition."
  },
  "episode": {
    "state": "not_estimable",
    "eligible": true,
    "data_ready": true,
    "model_estimated": true,
    "decision_eligible": true,
    "uncertainty": 0.2,
    "evidence_refs": [
      "synthetic:attention_rising_direction_unresolved:episode"
    ],
    "metrics": {},
    "invalidation": "Synthetic invalidation condition."
  },
  "structural_attention": {
    "state": "rising",
    "eligible": true,
    "data_ready": true,
    "model_estimated": true,
    "decision_eligible": false,
    "uncertainty": 0.2,
    "evidence_refs": [
      "synthetic:attention_rising_direction_unresolved:theme_radar_attention"
    ],
    "metrics": {},
    "invalidation": "Synthetic invalidation condition."
  },
  "fragility": {
    "state": "medium",
    "eligible": true,
    "data_ready": true,
    "model_estimated": true,
    "decision_eligible": true,
    "uncertainty": 0.2,
    "evidence_refs": [
      "synthetic:attention_rising_direction_unresolved:fragility"
    ],
    "metrics": {},
    "invalidation": "Synthetic invalidation condition."
  },
  "observer_agreement": {
    "score": 0.8,
    "estimated_observers": 5,
    "conflict_count": 1,
    "state": "conflicted"
  },
  "observer_conflicts": [
    {
      "theme_id": "semiconductors",
      "left": "theme_radar_attention",
      "right": "direction",
      "kind": "selection_pending",
      "explanation": "Structural attention is rising before the market has selected a reliable sign.",
      "severity": "medium",
      "discriminating_probe": "Observe the next close-period relative-strength confirmation."
    }
  ],
  "uncertainty": 0.2,
  "invalidation": [
    "Synthetic invalidation condition.",
    "Synthetic invalidation condition.",
    "Synthetic invalidation condition.",
    "Synthetic invalidation condition.",
    "Synthetic invalidation condition."
  ],
  "next_probe": {
    "probe_id": "semiconductors-direction-selection",
    "theme_id": "semiconductors",
    "acquire": "Next point-in-time relative-strength, VWAP, breadth, and close confirmation.",
    "distinguishes": [
      "positive signed release",
      "attention without signed release"
    ],
    "deadline_utc": "2026-08-10T19:45:00Z",
    "expected_information_value": "high",
    "acquisition_cost": "one scheduled market-data capture",
    "latency": "next frozen observation",
    "reason": "Structural attention is rising without signed confirmation.",
    "status": "proposed",
    "question": "Has structural attention selected a signed direction?"
  },
  "eligible_playbooks": [
    "D_wait_unresolved"
  ],
  "vehicle_eligibility": {
    "Theme_ETF": false,
    "Theme_Basket": false,
    "Torque_Overlay": false
  },
  "decision_status": "WAIT"
}
